[
    {
        "model_id": "9965",
        "brand": "AMD",
        "codename": "Turin Dense",
        "generation": "EPYC 9005 Series",
        "release_date": "2024-10-10",
        "socket_number": "1P / 2P",
        "price_usd": 14813.0,
        "specs": {
            "cores": 192,
            "threads": 384,
            "base_clock_ghz": 2.25,
            "boost_clock_ghz": 3.35,
            "tdp_watts": 500.0,
            "memory_type": "DDR5",
            "max_memory_speed_mt_s": "6000 MT/s",
            "memory_channels": 12,
            "pcie_lanes": 128,
            "pcie_version": 5.0,
            "simd_units": 8,
            "hbm_capacity_gb": 0,
            "fp64_units": 2,
            "fp32_units": 4
        },
        "features": [
            "AVX-512",
            "AVX2",
            "AVX",
            "ECC",
            "DDR5",
            "Virtualization"
        ],
        "description": "The AMD EPYC 9965 is a server/workstation processor with 192 cores, launched in October 2024, at an MSRP of $14813. It is part of the EPYC lineup, using the Zen 5c (Turin) architecture with Socket SP5. Thanks to AMD Simultaneous Multithreading (SMT) the core-count is effectively doubled, to 384 threads. To further increase overall system performance, up to two EPYC 9965 CPUs can work together in a multi-processor (SMP) configuration. EPYC 9965 has 384 MB of L3 cache and operates at 2.25 GHz by default, but can boost up to 3.7 GHz, depending on the workload. AMD is making the EPYC 9965 on a 3 nm production node, the transistor count is unknown. The silicon die of the chip is not fabricated at AMD, but at the foundry of TSMC. The multiplier is locked on EPYC 9965, which limits its overclocking potential.\nWith a TDP of 500 W, the EPYC 9965 is extremely power hungry, which means you need top-notch cooling. AMD's processor supports DDR5 memory with a twelve-channel interface. The highest officially supported memory speed is 6000 MT/s. ECC memory is supported, too, which is an important capability for mission-critical systems, to avoid data corruption. For communication with other components in the system, EPYC 9965 uses a PCI-Express Gen 5 connection. This processor lacks integrated graphics, you might need a graphics card.\nHardware virtualization is available on the EPYC 9965, which greatly improves virtual machine performance. Programs using Advanced Vector Extensions (AVX) can run on this processor, boosting performance for calculation-heavy applications. Besides AVX, AMD has added support for the newer AVX2 and AVX-512 instructions, too."
    },
    {
        "model_id": "9845",
        "brand": "AMD",
        "codename": "Turin Dense",
        "generation": "EPYC 9005 Series",
        "release_date": "2024-10-10",
        "socket_number": "1P / 2P",
        "price_usd": 13564.0,
        "specs": {
            "cores": 160,
            "threads": 320,
            "base_clock_ghz": 2.1,
            "boost_clock_ghz": 3.25,
            "tdp_watts": 390.0,
            "memory_type": "DDR5",
            "max_memory_speed_mt_s": "6000 MT/s",
            "memory_channels": 12,
            "pcie_lanes": 128,
            "pcie_version": 5.0,
            "simd_units": 8,
            "hbm_capacity_gb": 0,
            "fp64_units": 2,
            "fp32_units": 4
        },
        "features": [
            "AVX-512",
            "AVX2",
            "AVX",
            "ECC",
            "DDR5",
            "Virtualization"
        ],
        "description": "The AMD EPYC 9845 is a server/workstation processor with 160 cores, launched in October 2024, at an MSRP of $13564. It is part of the EPYC lineup, using the Zen 5c (Turin) architecture with Socket SP5. Thanks to AMD Simultaneous Multithreading (SMT) the core-count is effectively doubled, to 320 threads. To further increase overall system performance, up to two EPYC 9845 CPUs can link up in a multi-processor (SMP) configuration. EPYC 9845 has 320 MB of L3 cache and operates at 2.1 GHz by default, but can boost up to 3.7 GHz, depending on the workload. AMD is building the EPYC 9845 on a 3 nm production process, the transistor count is unknown. The silicon die of the chip is not fabricated at AMD, but at the foundry of TSMC. The multiplier is locked on EPYC 9845, which limits its overclocking capabilities.\nWith a TDP of 390 W, the EPYC 9845 is extremely power hungry, which means you need top-notch cooling. AMD's processor supports DDR5 memory with a twelve-channel interface. The highest officially supported memory speed is 6000 MT/s. ECC memory is supported, too, which is an important capability for mission-critical systems, to avoid data corruption. For communication with other components in the machine, EPYC 9845 uses a PCI-Express Gen 5 connection. This processor lacks integrated graphics, you might need a graphics card.\nHardware virtualization is available on the EPYC 9845, which greatly improves virtual machine performance. Programs using Advanced Vector Extensions (AVX) will run on this processor, boosting performance for calculation-heavy applications. Besides AVX, AMD has added support for the newer AVX2 and AVX-512 instructions, too."
    },
    {
        "model_id": "9825",
        "brand": "AMD",
        "codename": "Turin Dense",
        "generation": "EPYC 9005 Series",
        "release_date": "2024-10-10",
        "socket_number": "1P / 2P",
        "price_usd": 13006.0,
        "specs": {
            "cores": 144,
            "threads": 288,
            "base_clock_ghz": 2.2,
            "boost_clock_ghz": 3.3,
            "tdp_watts": 390.0,
            "memory_type": "DDR5",
            "max_memory_speed_mt_s": "6000 MT/s",
            "memory_channels": 12,
            "pcie_lanes": 128,
            "pcie_version": 5.0,
            "simd_units": 8,
            "hbm_capacity_gb": 0,
            "fp64_units": 2,
            "fp32_units": 4
        },
        "features": [
            "AVX-512",
            "AVX2",
            "AVX",
            "ECC",
            "DDR5",
            "Virtualization"
        ],
        "description": "The AMD EPYC 9825 is a server/workstation processor with 144 cores, launched in October 2024, at an MSRP of $13006. It is part of the EPYC lineup, using the Zen 5c (Turin) architecture with Socket SP5. Thanks to AMD Simultaneous Multithreading (SMT) the core-count is effectively doubled, to 288 threads. To further increase overall system performance, up to two EPYC 9825 CPUs can work together in a multi-processor (SMP) configuration. EPYC 9825 has 384 MB of L3 cache and operates at 2.2 GHz by default, but can boost up to 3.7 GHz, depending on the workload. AMD is making the EPYC 9825 on a 3 nm production node, the transistor count is unknown. The silicon die of the chip is not fabricated at AMD, but at the foundry of TSMC. The multiplier is locked on EPYC 9825, which limits its overclocking potential.\nWith a TDP of 390 W, the EPYC 9825 is extremely power hungry, which means you need top-notch cooling. AMD's processor supports DDR5 memory with a twelve-channel interface. The highest officially supported memory speed is 6000 MT/s. ECC memory is supported, too, which is an important capability for mission-critical systems, to avoid data corruption. For communication with other components in the computer, EPYC 9825 uses a PCI-Express Gen 5 connection. This processor lacks integrated graphics, you might need a graphics card.\nHardware virtualization is available on the EPYC 9825, which greatly improves virtual machine performance. Programs using Advanced Vector Extensions (AVX) can run on this processor, boosting performance for calculation-heavy applications. Besides AVX, AMD has added support for the newer AVX2 and AVX-512 instructions, too."
    },
    {
        "model_id": "9755",
        "brand": "AMD",
        "codename": "Turin",
        "generation": "EPYC 9005 Series",
        "release_date": "2024-10-10",
        "socket_number": "1P / 2P",
        "price_usd": 12984.0,
        "specs": {
            "cores": 128,
            "threads": 256,
            "base_clock_ghz": 2.7,
            "boost_clock_ghz": 4.1,
            "tdp_watts": 500.0,
            "memory_type": "DDR5",
            "max_memory_speed_mt_s": "6000 MT/s",
            "memory_channels": 12,
            "pcie_lanes": 128,
            "pcie_version": 5.0,
            "simd_units": 8,
            "hbm_capacity_gb": 0,
            "fp64_units": 2,
            "fp32_units": 4
        },
        "features": [
            "AVX-512",
            "AVX2",
            "AVX",
            "ECC",
            "DDR5",
            "Virtualization"
        ],
        "description": "The AMD EPYC 9755 is a server/workstation processor with 128 cores, launched in October 2024, at an MSRP of $12984. It is part of the EPYC lineup, using the Zen 5 (Turin) architecture with Socket SP5. Thanks to AMD Simultaneous Multithreading (SMT) the core-count is effectively doubled, to 256 threads. To further increase overall system performance, up to two EPYC 9755 CPUs can link up in a multi-processor (SMP) configuration. EPYC 9755 has 512 MB of L3 cache and operates at 2.7 GHz by default, but can boost up to 4.1 GHz, depending on the workload. AMD is building the EPYC 9755 on a 4 nm production process using 133,040 million transistors. The silicon die of the chip is not fabricated at AMD, but at the foundry of TSMC. The multiplier is locked on EPYC 9755, which limits its overclocking capabilities.\nWith a TDP of 500 W, the EPYC 9755 is extremely power hungry, which means you need top-notch cooling. AMD's processor supports DDR5 memory with a twelve-channel interface. The highest officially supported memory speed is 6000 MT/s. ECC memory is supported, too, which is an important capability for mission-critical systems, to avoid data corruption. For communication with other components in the machine, EPYC 9755 uses a PCI-Express Gen 5 connection. This processor lacks integrated graphics, you might need a graphics card.\nHardware virtualization is available on the EPYC 9755, which greatly improves virtual machine performance. Programs using Advanced Vector Extensions (AVX) will run on this processor, boosting performance for calculation-heavy applications. Besides AVX, AMD has added support for the newer AVX2 and AVX-512 instructions, too."
    },
    {
        "model_id": "9745",
        "brand": "AMD",
        "codename": "Turin",
        "generation": "EPYC 9005 Series",
        "release_date": "2024-10-10",
        "socket_number": "1P / 2P",
        "price_usd": 12141.0,
        "specs": {
            "cores": 128,
            "threads": 256,
            "base_clock_ghz": 2.4,
            "boost_clock_ghz": 3.45,
            "tdp_watts": 400.0,
            "memory_type": "DDR5",
            "max_memory_speed_mt_s": "6000 MT/s",
            "memory_channels": 12,
            "pcie_lanes": 128,
            "pcie_version": 5.0,
            "simd_units": 8,
            "hbm_capacity_gb": 0,
            "fp64_units": 2,
            "fp32_units": 4
        },
        "features": [
            "AVX-512",
            "AVX2",
            "AVX",
            "ECC",
            "DDR5",
            "Virtualization"
        ],
        "description": "The AMD EPYC 9745 is a server/workstation processor with 128 cores, launched in October 2024, at an MSRP of $12141. It is part of the EPYC lineup, using the Zen 5c (Turin) architecture with Socket SP5. Thanks to AMD Simultaneous Multithreading (SMT) the core-count is effectively doubled, to 256 threads. To further increase overall system performance, up to two EPYC 9745 CPUs can link up in a multi-processor (SMP) configuration. EPYC 9745 has 256 MB of L3 cache and operates at 2.4 GHz by default, but can boost up to 3.7 GHz, depending on the workload. AMD is building the EPYC 9745 on a 3 nm production process, the transistor count is unknown. The silicon die of the chip is not fabricated at AMD, but at the foundry of TSMC. The multiplier is locked on EPYC 9745, which limits its overclocking capabilities.\nWith a TDP of 400 W, the EPYC 9745 is extremely power hungry, which means you need top-notch cooling. AMD's processor supports DDR5 memory with a twelve-channel interface. The highest officially supported memory speed is 6000 MT/s. ECC memory is supported, too, which is an important capability for mission-critical systems, to avoid data corruption. For communication with other components in the system, EPYC 9745 uses a PCI-Express Gen 5 connection. This processor lacks integrated graphics, you might need a graphics card.\nHardware virtualization is available on the EPYC 9745, which greatly improves virtual machine performance. Programs using Advanced Vector Extensions (AVX) will run on this processor, boosting performance for calculation-heavy applications. Besides AVX, AMD has added support for the newer AVX2 and AVX-512 instructions, too."
    },
    {
        "model_id": "9655P",
        "brand": "AMD",
        "codename": "Turin",
        "generation": "EPYC 9005 Series",
        "release_date": "2024-10-10",
        "socket_number": "1P",
        "price_usd": 10811.0,
        "specs": {
            "cores": 96,
            "threads": 192,
            "base_clock_ghz": 2.6,
            "boost_clock_ghz": 4.1,
            "tdp_watts": 400.0,
            "memory_type": "DDR5",
            "max_memory_speed_mt_s": "6000 MT/s",
            "memory_channels": 12,
            "pcie_lanes": 128,
            "pcie_version": 5.0,
            "simd_units": 8,
            "hbm_capacity_gb": 0,
            "fp64_units": 2,
            "fp32_units": 4
        },
        "features": [
            "AVX-512",
            "AVX2",
            "AVX",
            "ECC",
            "DDR5",
            "Virtualization"
        ],
        "description": "The AMD EPYC 9655P is a server/workstation processor with 96 cores, launched in October 2024, at an MSRP of $10811. It is part of the EPYC lineup, using the Zen 5 (Turin) architecture with Socket SP5. Thanks to AMD Simultaneous Multithreading (SMT) the core-count is effectively doubled, to 192 threads. EPYC 9655P has 384 MB of L3 cache and operates at 2.6 GHz by default, but can boost up to 4.5 GHz, depending on the workload. AMD is building the EPYC 9655P on a 4 nm production process using 99,780 million transistors. The silicon die of the chip is not fabricated at AMD, but at the foundry of TSMC. The multiplier is locked on EPYC 9655P, which limits its overclocking capabilities.\nWith a TDP of 400 W, the EPYC 9655P is extremely power hungry, which means you need top-notch cooling. AMD's processor supports DDR5 memory with a twelve-channel interface. The highest officially supported memory speed is 6000 MT/s. ECC memory is supported, too, which is an important capability for mission-critical systems, to avoid data corruption. For communication with other components in the system, EPYC 9655P uses a PCI-Express Gen 5 connection. This processor lacks integrated graphics, you might need a graphics card.\nHardware virtualization is available on the EPYC 9655P, which greatly improves virtual machine performance. Programs using Advanced Vector Extensions (AVX) will run on this processor, boosting performance for calculation-heavy applications. Besides AVX, AMD has added support for the newer AVX2 and AVX-512 instructions, too."
    },
    {
        "model_id": "9655",
        "brand": "AMD",
        "codename": "Turin",
        "generation": "EPYC 9005 Series",
        "release_date": "2024-10-10",
        "socket_number": "1P / 2P",
        "price_usd": 11852.0,
        "specs": {
            "cores": 96,
            "threads": 192,
            "base_clock_ghz": 2.6,
            "boost_clock_ghz": 4.1,
            "tdp_watts": 400.0,
            "memory_type": "DDR5",
            "max_memory_speed_mt_s": "6000 MT/s",
            "memory_channels": 12,
            "pcie_lanes": 128,
            "pcie_version": 5.0,
            "simd_units": 8,
            "hbm_capacity_gb": 0,
            "fp64_units": 2,
            "fp32_units": 4
        },
        "features": [
            "AVX-512",
            "AVX2",
            "AVX",
            "ECC",
            "DDR5",
            "Virtualization"
        ],
        "description": "The AMD EPYC 9655 is a server/workstation processor with 96 cores, launched in October 2024, at an MSRP of $11852. It is part of the EPYC lineup, using the Zen 5 (Turin) architecture with Socket SP5. Thanks to AMD Simultaneous Multithreading (SMT) the core-count is effectively doubled, to 192 threads. To further increase overall system performance, up to two EPYC 9655 CPUs can work together in a multi-processor (SMP) configuration. EPYC 9655 has 384 MB of L3 cache and operates at 2.6 GHz by default, but can boost up to 4.5 GHz, depending on the workload. AMD is making the EPYC 9655 on a 4 nm production node using 99,780 million transistors. The silicon die of the chip is not fabricated at AMD, but at the foundry of TSMC. The multiplier is locked on EPYC 9655, which limits its overclocking potential.\nWith a TDP of 400 W, the EPYC 9655 is extremely power hungry, which means you need top-notch cooling. AMD's processor supports DDR5 memory with a twelve-channel interface. The highest officially supported memory speed is 6000 MT/s. ECC memory is supported, too, which is an important capability for mission-critical systems, to avoid data corruption. For communication with other components in the computer, EPYC 9655 uses a PCI-Express Gen 5 connection. This processor lacks integrated graphics, you might need a graphics card.\nHardware virtualization is available on the EPYC 9655, which greatly improves virtual machine performance. Programs using Advanced Vector Extensions (AVX) can run on this processor, boosting performance for calculation-heavy applications. Besides AVX, AMD has added support for the newer AVX2 and AVX-512 instructions, too."
    },
    {
        "model_id": "9645",
        "brand": "AMD",
        "codename": "Turin",
        "generation": "EPYC 9005 Series",
        "release_date": "2024-10-10",
        "socket_number": "1P / 2P",
        "price_usd": 11048.0,
        "specs": {
            "cores": 96,
            "threads": 192,
            "base_clock_ghz": 2.3,
            "boost_clock_ghz": 3.3,
            "tdp_watts": 320.0,
            "memory_type": "DDR5",
            "max_memory_speed_mt_s": "6000 MT/s",
            "memory_channels": 12,
            "pcie_lanes": 128,
            "pcie_version": 5.0,
            "simd_units": 8,
            "hbm_capacity_gb": 0,
            "fp64_units": 2,
            "fp32_units": 4
        },
        "features": [
            "AVX-512",
            "AVX2",
            "AVX",
            "ECC",
            "DDR5",
            "Virtualization"
        ],
        "description": "The AMD EPYC 9645 is a server/workstation processor with 96 cores, launched in October 2024, at an MSRP of $11048. It is part of the EPYC lineup, using the Zen 5c (Turin) architecture with Socket SP5. Thanks to AMD Simultaneous Multithreading (SMT) the core-count is effectively doubled, to 192 threads. To further increase overall system performance, up to two EPYC 9645 CPUs can work together in a multi-processor (SMP) configuration. EPYC 9645 has 256 MB of L3 cache and operates at 2.3 GHz by default, but can boost up to 3.7 GHz, depending on the workload. AMD is making the EPYC 9645 on a 3 nm production node, the transistor count is unknown. The silicon die of the chip is not fabricated at AMD, but at the foundry of TSMC. The multiplier is locked on EPYC 9645, which limits its overclocking potential.\nWith a TDP of 320 W, the EPYC 9645 is extremely power hungry, which means you need top-notch cooling. AMD's processor supports DDR5 memory with a twelve-channel interface. The highest officially supported memory speed is 6000 MT/s. ECC memory is supported, too, which is an important capability for mission-critical systems, to avoid data corruption. For communication with other components in the machine, EPYC 9645 uses a PCI-Express Gen 5 connection. This processor lacks integrated graphics, you might need a graphics card.\nHardware virtualization is available on the EPYC 9645, which greatly improves virtual machine performance. Programs using Advanced Vector Extensions (AVX) can run on this processor, boosting performance for calculation-heavy applications. Besides AVX, AMD has added support for the newer AVX2 and AVX-512 instructions, too."
    },
    {
        "model_id": "9575F",
        "brand": "AMD",
        "codename": "Turin",
        "generation": "EPYC 9005 Series",
        "release_date": "2024-10-10",
        "socket_number": "1P / 2P",
        "price_usd": 11791.0,
        "specs": {
            "cores": 64,
            "threads": 128,
            "base_clock_ghz": 3.3,
            "boost_clock_ghz": 4.5,
            "tdp_watts": 400.0,
            "memory_type": "DDR5",
            "max_memory_speed_mt_s": "6000 MT/s",
            "memory_channels": 12,
            "pcie_lanes": 128,
            "pcie_version": 5.0,
            "simd_units": 8,
            "hbm_capacity_gb": 0,
            "fp64_units": 2,
            "fp32_units": 4
        },
        "features": [
            "AVX-512",
            "AVX2",
            "AVX",
            "ECC",
            "DDR5",
            "Virtualization"
        ],
        "description": "The AMD EPYC 9575F is a server/workstation processor with 64 cores, launched in October 2024, at an MSRP of $11791. It is part of the EPYC lineup, using the Zen 5 (Turin) architecture with Socket SP5. Thanks to AMD Simultaneous Multithreading (SMT) the core-count is effectively doubled, to 128 threads. To further increase overall system performance, up to two EPYC 9575F CPUs can link up in a multi-processor (SMP) configuration. EPYC 9575F has 256 MB of L3 cache and operates at 3.3 GHz by default, but can boost up to 5 GHz, depending on the workload. AMD is building the EPYC 9575F on a 4 nm production process using 66,520 million transistors. The silicon die of the chip is not fabricated at AMD, but at the foundry of TSMC. The multiplier is locked on EPYC 9575F, which limits its overclocking capabilities.\nWith a TDP of 400 W, the EPYC 9575F is extremely power hungry, which means you need top-notch cooling. AMD's processor supports DDR5 memory with a twelve-channel interface. The highest officially supported memory speed is 6000 MT/s. ECC memory is supported, too, which is an important capability for mission-critical systems, to avoid data corruption. For communication with other components in the computer, EPYC 9575F uses a PCI-Express Gen 5 connection. This processor lacks integrated graphics, you might need a graphics card.\nHardware virtualization is available on the EPYC 9575F, which greatly improves virtual machine performance. Programs using Advanced Vector Extensions (AVX) will run on this processor, boosting performance for calculation-heavy applications. Besides AVX, AMD has added support for the newer AVX2 and AVX-512 instructions, too."
    },
    {
        "model_id": "9565",
        "brand": "AMD",
        "codename": "Turin",
        "generation": "EPYC 9005 Series",
        "release_date": "2024-10-10",
        "socket_number": "1P / 2P",
        "price_usd": 10486.0,
        "specs": {
            "cores": 72,
            "threads": 144,
            "base_clock_ghz": 3.15,
            "boost_clock_ghz": 4.2,
            "tdp_watts": 400.0,
            "memory_type": "DDR5",
            "max_memory_speed_mt_s": "6000 MT/s",
            "memory_channels": 12,
            "pcie_lanes": 128,
            "pcie_version": 5.0,
            "simd_units": 8,
            "hbm_capacity_gb": 0,
            "fp64_units": 2,
            "fp32_units": 4
        },
        "features": [
            "AVX-512",
            "AVX2",
            "AVX",
            "ECC",
            "DDR5",
            "Virtualization"
        ],
        "description": "The AMD EPYC 9565 is a server/workstation processor with 72 cores, launched in October 2024, at an MSRP of $10486. It is part of the EPYC lineup, using the Zen 5 (Turin) architecture with Socket SP5. Thanks to AMD Simultaneous Multithreading (SMT) the core-count is effectively doubled, to 144 threads. To further increase overall system performance, up to two EPYC 9565 CPUs can work together in a multi-processor (SMP) configuration. EPYC 9565 has 384 MB of L3 cache and operates at 3.15 GHz by default, but can boost up to 4.3 GHz, depending on the workload. AMD is making the EPYC 9565 on a 4 nm production node using 99,780 million transistors. The silicon die of the chip is not fabricated at AMD, but at the foundry of TSMC. The multiplier is locked on EPYC 9565, which limits its overclocking potential.\nWith a TDP of 400 W, the EPYC 9565 is extremely power hungry, which means you need top-notch cooling. AMD's processor supports DDR5 memory with a twelve-channel interface. The highest officially supported memory speed is 6000 MT/s. ECC memory is supported, too, which is an important capability for mission-critical systems, to avoid data corruption. For communication with other components in the machine, EPYC 9565 uses a PCI-Express Gen 5 connection. This processor lacks integrated graphics, you might need a graphics card.\nHardware virtualization is available on the EPYC 9565, which greatly improves virtual machine performance. Programs using Advanced Vector Extensions (AVX) can run on this processor, boosting performance for calculation-heavy applications. Besides AVX, AMD has added support for the newer AVX2 and AVX-512 instructions, too."
    },
    {
        "model_id": "9555P",
        "brand": "AMD",
        "codename": "Turin",
        "generation": "EPYC 9005 Series",
        "release_date": "2024-10-10",
        "socket_number": "1P",
        "price_usd": 7983.0,
        "specs": {
            "cores": 64,
            "threads": 128,
            "base_clock_ghz": 3.2,
            "boost_clock_ghz": 4.2,
            "tdp_watts": 360.0,
            "memory_type": "DDR5",
            "max_memory_speed_mt_s": "6000 MT/s",
            "memory_channels": 12,
            "pcie_lanes": 128,
            "pcie_version": 5.0,
            "simd_units": 8,
            "hbm_capacity_gb": 0,
            "fp64_units": 2,
            "fp32_units": 4
        },
        "features": [
            "AVX-512",
            "AVX2",
            "AVX",
            "ECC",
            "DDR5",
            "Virtualization"
        ],
        "description": "The AMD EPYC 9555P is a server/workstation processor with 64 cores, launched in October 2024, at an MSRP of $7983. It is part of the EPYC lineup, using the Zen 5 (Turin) architecture with Socket SP5. Thanks to AMD Simultaneous Multithreading (SMT) the core-count is effectively doubled, to 128 threads. EPYC 9555P has 256 MB of L3 cache and operates at 3.2 GHz by default, but can boost up to 4.4 GHz, depending on the workload. AMD is building the EPYC 9555P on a 4 nm production process using 66,520 million transistors. The silicon die of the chip is not fabricated at AMD, but at the foundry of TSMC. The multiplier is locked on EPYC 9555P, which limits its overclocking capabilities.\nWith a TDP of 360 W, the EPYC 9555P is extremely power hungry, which means you need top-notch cooling. AMD's processor supports DDR5 memory with a twelve-channel interface. The highest officially supported memory speed is 6000 MT/s. ECC memory is supported, too, which is an important capability for mission-critical systems, to avoid data corruption. For communication with other components in the machine, EPYC 9555P uses a PCI-Express Gen 5 connection. This processor lacks integrated graphics, you might need a graphics card.\nHardware virtualization is available on the EPYC 9555P, which greatly improves virtual machine performance. Programs using Advanced Vector Extensions (AVX) will run on this processor, boosting performance for calculation-heavy applications. Besides AVX, AMD has added support for the newer AVX2 and AVX-512 instructions, too."
    },
    {
        "model_id": "9555",
        "brand": "AMD",
        "codename": "Turin",
        "generation": "EPYC 9005 Series",
        "release_date": "2024-10-10",
        "socket_number": "1P / 2P",
        "price_usd": 9826.0,
        "specs": {
            "cores": 64,
            "threads": 128,
            "base_clock_ghz": 3.2,
            "boost_clock_ghz": 4.2,
            "tdp_watts": 360.0,
            "memory_type": "DDR5",
            "max_memory_speed_mt_s": "6000 MT/s",
            "memory_channels": 12,
            "pcie_lanes": 128,
            "pcie_version": 5.0,
            "simd_units": 8,
            "hbm_capacity_gb": 0,
            "fp64_units": 2,
            "fp32_units": 4
        },
        "features": [
            "AVX-512",
            "AVX2",
            "AVX",
            "ECC",
            "DDR5",
            "Virtualization"
        ],
        "description": "The AMD EPYC 9555 is a server/workstation processor with 64 cores, launched in October 2024, at an MSRP of $9826. It is part of the EPYC lineup, using the Zen 5 (Turin) architecture with Socket SP5. Thanks to AMD Simultaneous Multithreading (SMT) the core-count is effectively doubled, to 128 threads. To further increase overall system performance, up to two EPYC 9555 CPUs can work together in a multi-processor (SMP) configuration. EPYC 9555 has 256 MB of L3 cache and operates at 3.2 GHz by default, but can boost up to 4.4 GHz, depending on the workload. AMD is making the EPYC 9555 on a 4 nm production node using 66,520 million transistors. The silicon die of the chip is not fabricated at AMD, but at the foundry of TSMC. The multiplier is locked on EPYC 9555, which limits its overclocking potential.\nWith a TDP of 360 W, the EPYC 9555 is extremely power hungry, which means you need top-notch cooling. AMD's processor supports DDR5 memory with a twelve-channel interface. The highest officially supported memory speed is 6000 MT/s. ECC memory is supported, too, which is an important capability for mission-critical systems, to avoid data corruption. For communication with other components in the system, EPYC 9555 uses a PCI-Express Gen 5 connection. This processor lacks integrated graphics, you might need a graphics card.\nHardware virtualization is available on the EPYC 9555, which greatly improves virtual machine performance. Programs using Advanced Vector Extensions (AVX) can run on this processor, boosting performance for calculation-heavy applications. Besides AVX, AMD has added support for the newer AVX2 and AVX-512 instructions, too."
    },
    {
        "model_id": "9535",
        "brand": "AMD",
        "codename": "Turin",
        "generation": "EPYC 9005 Series",
        "release_date": "2024-10-10",
        "socket_number": "1P / 2P",
        "price_usd": 8992.0,
        "specs": {
            "cores": 64,
            "threads": 128,
            "base_clock_ghz": 2.4,
            "boost_clock_ghz": 3.5,
            "tdp_watts": 300.0,
            "memory_type": "DDR5",
            "max_memory_speed_mt_s": "6000 MT/s",
            "memory_channels": 12,
            "pcie_lanes": 128,
            "pcie_version": 5.0,
            "simd_units": 8,
            "hbm_capacity_gb": 0,
            "fp64_units": 2,
            "fp32_units": 4
        },
        "features": [
            "AVX-512",
            "AVX2",
            "AVX",
            "ECC",
            "DDR5",
            "Virtualization"
        ],
        "description": "The AMD EPYC 9535 is a server/workstation processor with 64 cores, launched in October 2024, at an MSRP of $8992. It is part of the EPYC lineup, using the Zen 5 (Turin) architecture with Socket SP5. Thanks to AMD Simultaneous Multithreading (SMT) the core-count is effectively doubled, to 128 threads. To further increase overall system performance, up to two EPYC 9535 CPUs can work together in a multi-processor (SMP) configuration. EPYC 9535 has 256 MB of L3 cache and operates at 2.4 GHz by default, but can boost up to 4.3 GHz, depending on the workload. AMD is making the EPYC 9535 on a 4 nm production node using 66,520 million transistors. The silicon die of the chip is not fabricated at AMD, but at the foundry of TSMC. The multiplier is locked on EPYC 9535, which limits its overclocking potential.\nWith a TDP of 300 W, the EPYC 9535 is extremely power hungry, which means you need top-notch cooling. AMD's processor supports DDR5 memory with a twelve-channel interface. The highest officially supported memory speed is 6000 MT/s. ECC memory is supported, too, which is an important capability for mission-critical systems, to avoid data corruption. For communication with other components in the computer, EPYC 9535 uses a PCI-Express Gen 5 connection. This processor lacks integrated graphics, you might need a graphics card.\nHardware virtualization is available on the EPYC 9535, which greatly improves virtual machine performance. Programs using Advanced Vector Extensions (AVX) can run on this processor, boosting performance for calculation-heavy applications. Besides AVX, AMD has added support for the newer AVX2 and AVX-512 instructions, too."
    },
    {
        "model_id": "9475F",
        "brand": "AMD",
        "codename": "Turin",
        "generation": "EPYC 9005 Series",
        "release_date": "2024-10-10",
        "socket_number": "1P / 2P",
        "price_usd": 7592.0,
        "specs": {
            "cores": 48,
            "threads": 96,
            "base_clock_ghz": 3.65,
            "boost_clock_ghz": 4.4,
            "tdp_watts": 400.0,
            "memory_type": "DDR5",
            "max_memory_speed_mt_s": "6000 MT/s",
            "memory_channels": 12,
            "pcie_lanes": 128,
            "pcie_version": 5.0,
            "simd_units": 8,
            "hbm_capacity_gb": 0,
            "fp64_units": 2,
            "fp32_units": 4
        },
        "features": [
            "AVX-512",
            "AVX2",
            "AVX",
            "ECC",
            "DDR5",
            "Virtualization"
        ],
        "description": "The AMD EPYC 9475F is a server/workstation processor with 48 cores, launched in October 2024, at an MSRP of $7592. It is part of the EPYC lineup, using the Zen 5 (Turin) architecture with Socket SP5. Thanks to AMD Simultaneous Multithreading (SMT) the core-count is effectively doubled, to 96 threads. To further increase overall system performance, up to two EPYC 9475F CPUs can link up in a multi-processor (SMP) configuration. EPYC 9475F has 256 MB of L3 cache and operates at 3.65 GHz by default, but can boost up to 4.8 GHz, depending on the workload. AMD is building the EPYC 9475F on a 4 nm production process using 66,520 million transistors. The silicon die of the chip is not fabricated at AMD, but at the foundry of TSMC. The multiplier is locked on EPYC 9475F, which limits its overclocking capabilities.\nWith a TDP of 400 W, the EPYC 9475F is extremely power hungry, which means you need top-notch cooling. AMD's processor supports DDR5 memory with a twelve-channel interface. The highest officially supported memory speed is 6000 MT/s. ECC memory is supported, too, which is an important capability for mission-critical systems, to avoid data corruption. For communication with other components in the system, EPYC 9475F uses a PCI-Express Gen 5 connection. This processor lacks integrated graphics, you might need a graphics card.\nHardware virtualization is available on the EPYC 9475F, which greatly improves virtual machine performance. Programs using Advanced Vector Extensions (AVX) will run on this processor, boosting performance for calculation-heavy applications. Besides AVX, AMD has added support for the newer AVX2 and AVX-512 instructions, too."
    },
    {
        "model_id": "9455P",
        "brand": "AMD",
        "codename": "Turin",
        "generation": "EPYC 9005 Series",
        "release_date": "2024-10-10",
        "socket_number": "1P",
        "price_usd": 4819.0,
        "specs": {
            "cores": 48,
            "threads": 96,
            "base_clock_ghz": 3.15,
            "boost_clock_ghz": 4.1,
            "tdp_watts": 300.0,
            "memory_type": "DDR5",
            "max_memory_speed_mt_s": "6000 MT/s",
            "memory_channels": 12,
            "pcie_lanes": 128,
            "pcie_version": 5.0,
            "simd_units": 8,
            "hbm_capacity_gb": 0,
            "fp64_units": 2,
            "fp32_units": 4
        },
        "features": [
            "AVX-512",
            "AVX2",
            "AVX",
            "ECC",
            "DDR5",
            "Virtualization"
        ],
        "description": "The AMD EPYC 9455P is a server/workstation processor with 48 cores, launched in October 2024, at an MSRP of $4819. It is part of the EPYC lineup, using the Zen 5 (Turin) architecture with Socket SP5. Thanks to AMD Simultaneous Multithreading (SMT) the core-count is effectively doubled, to 96 threads. EPYC 9455P has 256 MB of L3 cache and operates at 3.15 GHz by default, but can boost up to 4.4 GHz, depending on the workload. AMD is making the EPYC 9455P on a 4 nm production node using 66,520 million transistors. The silicon die of the chip is not fabricated at AMD, but at the foundry of TSMC. The multiplier is locked on EPYC 9455P, which limits its overclocking potential.\nWith a TDP of 300 W, the EPYC 9455P is extremely power hungry, which means you need top-notch cooling. AMD's processor supports DDR5 memory with a twelve-channel interface. The highest officially supported memory speed is 6000 MT/s. ECC memory is supported, too, which is an important capability for mission-critical systems, to avoid data corruption. For communication with other components in the system, EPYC 9455P uses a PCI-Express Gen 5 connection. This processor lacks integrated graphics, you might need a graphics card.\nHardware virtualization is available on the EPYC 9455P, which greatly improves virtual machine performance. Programs using Advanced Vector Extensions (AVX) can run on this processor, boosting performance for calculation-heavy applications. Besides AVX, AMD has added support for the newer AVX2 and AVX-512 instructions, too."
    },
    {
        "model_id": "9455",
        "brand": "AMD",
        "codename": "Turin",
        "generation": "EPYC 9005 Series",
        "release_date": "2024-10-10",
        "socket_number": "1P / 2P",
        "price_usd": 5412.0,
        "specs": {
            "cores": 48,
            "threads": 96,
            "base_clock_ghz": 3.15,
            "boost_clock_ghz": 4.1,
            "tdp_watts": 300.0,
            "memory_type": "DDR5",
            "max_memory_speed_mt_s": "6000 MT/s",
            "memory_channels": 12,
            "pcie_lanes": 128,
            "pcie_version": 5.0,
            "simd_units": 8,
            "hbm_capacity_gb": 0,
            "fp64_units": 2,
            "fp32_units": 4
        },
        "features": [
            "AVX-512",
            "AVX2",
            "AVX",
            "ECC",
            "DDR5",
            "Virtualization"
        ],
        "description": "The AMD EPYC 9455 is a server/workstation processor with 48 cores, launched in October 2024, at an MSRP of $5412. It is part of the EPYC lineup, using the Zen 5 (Turin) architecture with Socket SP5. Thanks to AMD Simultaneous Multithreading (SMT) the core-count is effectively doubled, to 96 threads. To further increase overall system performance, up to two EPYC 9455 CPUs can work together in a multi-processor (SMP) configuration. EPYC 9455 has 256 MB of L3 cache and operates at 3.15 GHz by default, but can boost up to 4.4 GHz, depending on the workload. AMD is making the EPYC 9455 on a 4 nm production node using 66,520 million transistors. The silicon die of the chip is not fabricated at AMD, but at the foundry of TSMC. The multiplier is locked on EPYC 9455, which limits its overclocking potential.\nWith a TDP of 300 W, the EPYC 9455 is extremely power hungry, which means you need top-notch cooling. AMD's processor supports DDR5 memory with a twelve-channel interface. The highest officially supported memory speed is 6000 MT/s. ECC memory is supported, too, which is an important capability for mission-critical systems, to avoid data corruption. For communication with other components in the machine, EPYC 9455 uses a PCI-Express Gen 5 connection. This processor lacks integrated graphics, you might need a graphics card.\nHardware virtualization is available on the EPYC 9455, which greatly improves virtual machine performance. Programs using Advanced Vector Extensions (AVX) can run on this processor, boosting performance for calculation-heavy applications. Besides AVX, AMD has added support for the newer AVX2 and AVX-512 instructions, too."
    },
    {
        "model_id": "9375F",
        "brand": "AMD",
        "codename": "Turin",
        "generation": "EPYC 9005 Series",
        "release_date": "2024-10-10",
        "socket_number": "1P / 2P",
        "price_usd": 5306.0,
        "specs": {
            "cores": 32,
            "threads": 64,
            "base_clock_ghz": 3.8,
            "boost_clock_ghz": 4.4,
            "tdp_watts": 320.0,
            "memory_type": "DDR5",
            "max_memory_speed_mt_s": "6000 MT/s",
            "memory_channels": 12,
            "pcie_lanes": 128,
            "pcie_version": 5.0,
            "simd_units": 8,
            "hbm_capacity_gb": 0,
            "fp64_units": 2,
            "fp32_units": 4
        },
        "features": [
            "AVX-512",
            "AVX2",
            "AVX",
            "ECC",
            "DDR5",
            "Virtualization"
        ],
        "description": "The AMD EPYC 9375F is a server/workstation processor with 32 cores, launched in October 2024, at an MSRP of $5306. It is part of the EPYC lineup, using the Zen 5 (Turin) architecture with Socket SP5. Thanks to AMD Simultaneous Multithreading (SMT) the core-count is effectively doubled, to 64 threads. To further increase overall system performance, up to two EPYC 9375F CPUs can work together in a multi-processor (SMP) configuration. EPYC 9375F has 256 MB of L3 cache and operates at 3.85 GHz by default, but can boost up to 4.8 GHz, depending on the workload. AMD is making the EPYC 9375F on a 4 nm production node using 66,520 million transistors. The silicon die of the chip is not fabricated at AMD, but at the foundry of TSMC. The multiplier is locked on EPYC 9375F, which limits its overclocking potential.\nWith a TDP of 320 W, the EPYC 9375F is extremely power hungry, which means you need top-notch cooling. AMD's processor supports DDR5 memory with a twelve-channel interface. The highest officially supported memory speed is 6000 MT/s. ECC memory is supported, too, which is an important capability for mission-critical systems, to avoid data corruption. For communication with other components in the computer, EPYC 9375F uses a PCI-Express Gen 5 connection. This processor lacks integrated graphics, you might need a graphics card.\nHardware virtualization is available on the EPYC 9375F, which greatly improves virtual machine performance. Programs using Advanced Vector Extensions (AVX) can run on this processor, boosting performance for calculation-heavy applications. Besides AVX, AMD has added support for the newer AVX2 and AVX-512 instructions, too."
    },
    {
        "model_id": "9365",
        "brand": "AMD",
        "codename": "Turin",
        "generation": "EPYC 9005 Series",
        "release_date": "2024-10-10",
        "socket_number": "1P / 2P",
        "price_usd": 4341.0,
        "specs": {
            "cores": 36,
            "threads": 72,
            "base_clock_ghz": 3.4,
            "boost_clock_ghz": 4.15,
            "tdp_watts": 300.0,
            "memory_type": "DDR5",
            "max_memory_speed_mt_s": "6000 MT/s",
            "memory_channels": 12,
            "pcie_lanes": 128,
            "pcie_version": 5.0,
            "simd_units": 8,
            "hbm_capacity_gb": 0,
            "fp64_units": 2,
            "fp32_units": 4
        },
        "features": [
            "AVX-512",
            "AVX2",
            "AVX",
            "ECC",
            "DDR5",
            "Virtualization"
        ],
        "description": "The AMD EPYC 9365 is a server/workstation processor with 36 cores, launched in October 2024, at an MSRP of $4341. It is part of the EPYC lineup, using the Zen 5 (Turin) architecture with Socket SP5. Thanks to AMD Simultaneous Multithreading (SMT) the core-count is effectively doubled, to 72 threads. To further increase overall system performance, up to two EPYC 9365 CPUs can link up in a multi-processor (SMP) configuration. EPYC 9365 has 192 MB of L3 cache and operates at 3.4 GHz by default, but can boost up to 4.3 GHz, depending on the workload. AMD is building the EPYC 9365 on a 4 nm production process using 49,890 million transistors. The silicon die of the chip is not fabricated at AMD, but at the foundry of TSMC. The multiplier is locked on EPYC 9365, which limits its overclocking capabilities.\nWith a TDP of 300 W, the EPYC 9365 is extremely power hungry, which means you need top-notch cooling. AMD's processor supports DDR5 memory with a twelve-channel interface. The highest officially supported memory speed is 6000 MT/s. ECC memory is supported, too, which is an important capability for mission-critical systems, to avoid data corruption. For communication with other components in the machine, EPYC 9365 uses a PCI-Express Gen 5 connection. This processor lacks integrated graphics, you might need a graphics card.\nHardware virtualization is available on the EPYC 9365, which greatly improves virtual machine performance. Programs using Advanced Vector Extensions (AVX) will run on this processor, boosting performance for calculation-heavy applications. Besides AVX, AMD has added support for the newer AVX2 and AVX-512 instructions, too."
    },
    {
        "model_id": "9355P",
        "brand": "AMD",
        "codename": "Turin",
        "generation": "EPYC 9005 Series",
        "release_date": "2024-10-10",
        "socket_number": "1P",
        "price_usd": 2998.0,
        "specs": {
            "cores": 32,
            "threads": 64,
            "base_clock_ghz": 3.55,
            "boost_clock_ghz": 4.2,
            "tdp_watts": 280.0,
            "memory_type": "DDR5",
            "max_memory_speed_mt_s": "6000 MT/s",
            "memory_channels": 12,
            "pcie_lanes": 128,
            "pcie_version": 5.0,
            "simd_units": 8,
            "hbm_capacity_gb": 0,
            "fp64_units": 2,
            "fp32_units": 4
        },
        "features": [
            "AVX-512",
            "AVX2",
            "AVX",
            "ECC",
            "DDR5",
            "Virtualization"
        ],
        "description": "The AMD EPYC 9355P is a server/workstation processor with 32 cores, launched in October 2024, at an MSRP of $2998. It is part of the EPYC lineup, using the Zen 5 (Turin) architecture with Socket SP5. Thanks to AMD Simultaneous Multithreading (SMT) the core-count is effectively doubled, to 64 threads. EPYC 9355P has 256 MB of L3 cache and operates at 3.55 GHz by default, but can boost up to 4.4 GHz, depending on the workload. AMD is making the EPYC 9355P on a 4 nm production node using 66,520 million transistors. The silicon die of the chip is not fabricated at AMD, but at the foundry of TSMC. The multiplier is locked on EPYC 9355P, which limits its overclocking potential.\nWith a TDP of 280 W, the EPYC 9355P is extremely power hungry, which means you need top-notch cooling. AMD's processor supports DDR5 memory with a twelve-channel interface. The highest officially supported memory speed is 6000 MT/s. ECC memory is supported, too, which is an important capability for mission-critical systems, to avoid data corruption. For communication with other components in the machine, EPYC 9355P uses a PCI-Express Gen 5 connection. This processor lacks integrated graphics, you might need a graphics card.\nHardware virtualization is available on the EPYC 9355P, which greatly improves virtual machine performance. Programs using Advanced Vector Extensions (AVX) can run on this processor, boosting performance for calculation-heavy applications. Besides AVX, AMD has added support for the newer AVX2 and AVX-512 instructions, too."
    },
    {
        "model_id": "9355",
        "brand": "AMD",
        "codename": "Turin",
        "generation": "EPYC 9005 Series",
        "release_date": "2024-10-10",
        "socket_number": "1P / 2P",
        "price_usd": 3694.0,
        "specs": {
            "cores": 32,
            "threads": 64,
            "base_clock_ghz": 3.55,
            "boost_clock_ghz": 4.2,
            "tdp_watts": 280.0,
            "memory_type": "DDR5",
            "max_memory_speed_mt_s": "6000 MT/s",
            "memory_channels": 12,
            "pcie_lanes": 128,
            "pcie_version": 5.0,
            "simd_units": 8,
            "hbm_capacity_gb": 0,
            "fp64_units": 2,
            "fp32_units": 4
        },
        "features": [
            "AVX-512",
            "AVX2",
            "AVX",
            "ECC",
            "DDR5",
            "Virtualization"
        ],
        "description": "The AMD EPYC 9355 is a server/workstation processor with 32 cores, launched in October 2024, at an MSRP of $3694. It is part of the EPYC lineup, using the Zen 5 (Turin) architecture with Socket SP5. Thanks to AMD Simultaneous Multithreading (SMT) the core-count is effectively doubled, to 64 threads. To further increase overall system performance, up to two EPYC 9355 CPUs can link up in a multi-processor (SMP) configuration. EPYC 9355 has 256 MB of L3 cache and operates at 3.55 GHz by default, but can boost up to 4.4 GHz, depending on the workload. AMD is building the EPYC 9355 on a 4 nm production process using 66,520 million transistors. The silicon die of the chip is not fabricated at AMD, but at the foundry of TSMC. The multiplier is locked on EPYC 9355, which limits its overclocking capabilities.\nWith a TDP of 280 W, the EPYC 9355 is extremely power hungry, which means you need top-notch cooling. AMD's processor supports DDR5 memory with a twelve-channel interface. The highest officially supported memory speed is 6000 MT/s. ECC memory is supported, too, which is an important capability for mission-critical systems, to avoid data corruption. For communication with other components in the system, EPYC 9355 uses a PCI-Express Gen 5 connection. This processor lacks integrated graphics, you might need a graphics card.\nHardware virtualization is available on the EPYC 9355, which greatly improves virtual machine performance. Programs using Advanced Vector Extensions (AVX) will run on this processor, boosting performance for calculation-heavy applications. Besides AVX, AMD has added support for the newer AVX2 and AVX-512 instructions, too."
    },
    {
        "model_id": "9335",
        "brand": "AMD",
        "codename": "Turin",
        "generation": "EPYC 9005 Series",
        "release_date": "2024-10-10",
        "socket_number": "1P / 2P",
        "price_usd": 3178.0,
        "specs": {
            "cores": 32,
            "threads": 64,
            "base_clock_ghz": 3.0,
            "boost_clock_ghz": 4.0,
            "tdp_watts": 210.0,
            "memory_type": "DDR5",
            "max_memory_speed_mt_s": "6000 MT/s",
            "memory_channels": 12,
            "pcie_lanes": 128,
            "pcie_version": 5.0,
            "simd_units": 8,
            "hbm_capacity_gb": 0,
            "fp64_units": 2,
            "fp32_units": 4
        },
        "features": [
            "AVX-512",
            "AVX2",
            "AVX",
            "ECC",
            "DDR5",
            "Virtualization"
        ],
        "description": "The AMD EPYC 9335 is a server/workstation processor with 32 cores, launched in October 2024, at an MSRP of $3178. It is part of the EPYC lineup, using the Zen 5 (Turin) architecture with Socket SP5. Thanks to AMD Simultaneous Multithreading (SMT) the core-count is effectively doubled, to 64 threads. To further increase overall system performance, up to two EPYC 9335 CPUs can link up in a multi-processor (SMP) configuration. EPYC 9335 has 128 MB of L3 cache and operates at 3 GHz by default, but can boost up to 4.4 GHz, depending on the workload. AMD is building the EPYC 9335 on a 4 nm production process using 33,260 million transistors. The silicon die of the chip is not fabricated at AMD, but at the foundry of TSMC. The multiplier is locked on EPYC 9335, which limits its overclocking capabilities.\nWith a TDP of 210 W, the EPYC 9335 is extremely power hungry, which means you need top-notch cooling. AMD's processor supports DDR5 memory with a twelve-channel interface. The highest officially supported memory speed is 6000 MT/s. ECC memory is supported, too, which is an important capability for mission-critical systems, to avoid data corruption. For communication with other components in the computer, EPYC 9335 uses a PCI-Express Gen 5 connection. This processor lacks integrated graphics, you might need a graphics card.\nHardware virtualization is available on the EPYC 9335, which greatly improves virtual machine performance. Programs using Advanced Vector Extensions (AVX) will run on this processor, boosting performance for calculation-heavy applications. Besides AVX, AMD has added support for the newer AVX2 and AVX-512 instructions, too."
    }
]